link,writer,time,text
https://lh3.googleusercontent.com/a/ACg8ocLDruqRVgPei0bMjYxVYMAWqUOPLDHK6YTvxjsrd-FmUHN35w=w43-h43-p-rp-mo-br100,Sophie,a year ago,"I went to the ER last night at around 11:30pm for debilitating knee pain. The waiting room was full and I was prepared for a long wait. The nurses were pleasant and courteous and the doctor was amazing, thank you Dr. Carroll! He was patient, thorough and answered all of my questions without rushing. I know many people were in worst condition than I was and I felt like they should be treated first. I feel that if you treat nurses/staff with respect and kindness, you will receive the same treatment. They are overwhelmed and overworked these days and a little kindness and compassion goes a long way. I was done in a total of 5 hours, with x-rays and prescription in hand…thank you Surrey Memorial!"
https://lh3.googleusercontent.com/a/ACg8ocKkdfacNBpovzyafo6td9pq-wqCsihU493Xs3FDOrpMURr7Eg=w43-h43-p-rp-mo-br100,Don Andrews,9 months ago,"I see my review seemingly disappeared. Couldn’t stand the truth about the garbage hole that is Surrey Memorial Hospital. Well here is repost. See how long this stays up.
I guess the best way to approach this would be to say that Surrey Memorial Hospital could quite possibly be the worst hospital in the world. And possibly have the worst doctors and nurses working in any hospital in the world.
These so called doctors and nurses think they are immune to their being held accountable and in my case they probably won't be because I'll be dead before they can be brought to Justice in a court of law. But make no mistake in my opinion they have destroyed human life simply because they are inept and do not deserve to practice medicine anywhere in the world. But of course that doesn't matter in British Columbia. It seems that any doctor will do in this province.
If this were a movie I would suggest that they should be tried as murderers. But since this is not a movie I can't say that. Because that would upset there Poor little egos and make them sad.
But of course turning me into a quadriplegic I'm sure was just fun and part of their daily humour.
See you in court if I live that long. If I do live that long there are 12 doctors that I will demand that their licenses be revoked and their pensions be suspended and that they never practice another day of medicine in their life. See if you have the guts to leave this review up."
https://lh3.googleusercontent.com/a-/ALV-UjU2bhOSUUhSu93H5J9LztP9fScxUObj0iOOpBXVt48q_lyYBfIX=w43-h43-p-rp-mo-ba3-br100,Rhianna Boorman,10 months ago,"Avoid this hospital at all costs if you're going in for the family birthing unit.

Aside from the fact that I was never even fed until we bought food, they then proceeded to tell me what was my fault and ""they didn't know"", despite telling multiple nurses previously. They refused to bring any late tray, stating that ""lunch time is over and you can wait for dinner"". Keeping in mind that I had been admitted since 8am and never got breakfast or lunch.

Speaking of being admitted. We phoned in early, left a little bit after. On the call they instructed us to come in and we'd be immediately ready to go when we arrived. However this was not the case when we arrived, 3 hours after the call. They were not prepared and we ended up waiting an extra 2 hours to be admitted because they ""didn't have a chart"" for me. They think they're talking quietly amongst eachother but we can hear everything that's being said, which is how we knew that issue has arose.

After this, and multiple other issues that are piling on, that can see that I'm obviously distressed.  When trying to have skin to skin moments, they told me to put my baby down because ""that's how you get clingy spoiled babies"". They also insisted that I could not breastfeed and instead told me to give up and forced us to use formula. This is a hospital that doesn't provide any nurturing care, they provide just barely enough care to even call it a hospital. During this time as well, the same nurse was absolutely sassy and had no place to say many things that she did. One of them being ""Of course your husband wouldn't write it down"", basically implying that he couldn't be responsible with babies simply because she never gave us a pen to fill in the feeding chart. She didn't have to be so disgustingly rude about it. Especially to say these things behind his back, while he was getting us prepared to leave.

Only one single night nurse was extremely helpful. She brought an extra dinner tray, as well she also was a lot more encouraging than anybody else for the entire time.  She insisted that the nurse, that I had spoken to,  was in the wrong and helped validate the concerns I had. She insisted she could help if we knew who the other nurse was, but unfortunately these nurses think it's appropriate to not wear their name tags. I assume that this is so that way they can make ill informed choices and decisions for their patients, without repercussions. Sadly, that's about the only positive thing that happened during the stay.

They nurses are so over the top with their lack of safety that they insisted they had to see the carseat we have (not a bucket, so it's super heavy), which led to another fight. So we had to wheelchair a carseat in and out, which was absolutely ridiculous as they are not trained to check car seats. their ""check"" could've been done with photos, as they only ""need"" to see the expiration dates and such. Which I say ""need"" in quotes because they didn't even look for it. They forced us to bring up a 40lbs car seat just so they could say ""we can't find the stickers"" and to confirm with us the year that we got our seat. During the car seat check they also decided to ""fix"" our tightness of the belts because ""we don't want it to choke your baby"". This was an ill-informed.comment, as it's impossible to choke a child with a carseat, when done correctly. Instead they loosened my baby's belts an extra 2 inches, leaving the baby in a compromised position incase of an accident. This is a small baby and she would have went FLYING out of the seat, if I did not retighten the belts after we left.

Overall this was the worst possible birthing experience I have ever had in my life. However, I didn't get a choice of hospital. If you get one, run away from SMH."
https://lh3.googleusercontent.com/a/ACg8ocLVksu2vskjwN40n-NdYhVCF3bDpQ0-N88t2niHLvJKWSOgYA=w43-h43-p-rp-mo-br100,Ken Wilson,2 years ago,"A rating of 2.2 for this hospital is way too high.  I would not want my worst enemy to have to go to this hospital.  The cleanliness leaves a lot to be desired.  Unfortunately I spend a week at this hospital with my son.  The care was next to non existent, If we did not spend 24 hour attendance with him he would have had a worse experience.  In fairness there were a couple of caring nurses and the doctor once admitted did the best he could.  However , a  5 and 1/2 hour wait for an ambulance, then almost 2 days in emergency with no food or water.  We had to go to the head nurse to get fluids and a proper bed for our son.  You are just a number in this hospital , it really lacks in compassion and caring for another human being.
Very disappointed in this facility,  health care has hit the very bottom in this hospital. Very sad indeed..
Our son was sent home and he passed that evening."
https://lh3.googleusercontent.com/a/ACg8ocL5MvwPCrh60PXzUB4ScIBWRktMn9__CNnXz3PPage-KTjcjw=w43-h43-p-rp-mo-ba3-br100,Diya Malik,9 months ago,"Worst hospital. Just for small tests and examinations, I waited for more than 10 hours in waiting area n 3 hours for doctor to just consult. I asked if I can go and eat and drink something, they told me we will call ur name three times if u don't show up then wait again for long! Worst hospital really! Waiting for this long, a patient can get more critical."
https://lh3.googleusercontent.com/a-/ALV-UjWgCeYH-ohsHQM07U_O7sLb3_0juOCW0GjXHsN9T-ymQFP-IMZ3CA=w43-h43-p-rp-mo-ba3-br100,Shelby Youritchuk,a year ago,"I've had some health issues and have had to go to the emergency several times. Last night I was there for 12 HOURS before I saw a doctor. I had severe back pain that made me vomit all over the place. Eventually I had to lay on the waiting room floor to get comfortable from the pain. When I finally saw a doctor after 12 hours,  he told me to take tylenol and rest for 9 weeks! He barley examined me and spoke to him for about 2 minutes."
https://lh3.googleusercontent.com/a/ACg8ocIkEjlhyT1qu9pL3iEmilPq9pv7T9ku8JUUw3dG_t8kTPizuB4=w43-h43-p-rp-mo-ba3-br100,Jashanpreet Badesha,4 months ago,"Too worst . I was dying with body-ache and fever and they were saying to wait for 8 hours. This is not the way to treat your patients . The wait was only to just get in and then there was further wait at different corners . A person might die of that wait but they always say that it is busy , we can’t do anything . This is not a good sign of an emergency hospital . Please improve your service towards patients."
https://lh3.googleusercontent.com/a/ACg8ocKJY4pkBb4pHwwzrbe-7iqm-FA6sK0Lmv4VFEZHTwVLbX5h2w=w43-h43-p-rp-mo-br100,darkstarsphoto,a year ago,"My partner was having issues and we waited 2.5 hours for an ambulance even at code red. Entered the building at 2:30 pm and finally saw a Dr. At 1 am. After waiting all that time my partner asked a clerk for some tylenol the nurse told us to take it in the previous waiting room and to wait for the Dr.... even though the doctor said ""wait here My shift is almost done I will be right back"". Due to that nurse telling us to wait elsewhere we eventually saw the doctor leave in his street clothes. Way to to guys... have patients wait that long for someone else to tell them to wait elsewhere where they are not going to be seen. Always has been a nightmare here nothing new."
https://lh3.googleusercontent.com/a-/ALV-UjXeL2-rPsiwmq_jr-UJXv7rlCDe5OQ5Lh7EFuH82oZU3YnlxJjx=w43-h43-p-rp-mo-ba3-br100,Tamer Negm,10 months ago,"I went there for emergency, couple days ago, the area is full and not clean. People sitting in the hallway and getting treatment in hallway. I decided not to stay and go to another hospital. This hospital is very crowded and hope they hire more staff to serve people better. The emergency area has to be enhanced and have much rooms."
https://lh3.googleusercontent.com/a/ACg8ocINewZ9yLpgOIWyl8xVpqi_8M5X7w0S55ZjiDAYPilqgPYGMBo=w43-h43-p-rp-mo-br100,may b,a year ago,"I understand healthcare is experiencing systematic failure due to higher demands. This hospital is the most shortstaffed hospital in BC. Having said that, I think there is a certain level of lack of transparency, and even corruption, at all levels, that has allowed some of the worst healthcare providers to stay employed, IN SPITE OF, and not because of the shortage of healthcare workers. There is no amount of news coverage that would convince me, that the 2 receptionists at the ER reception, sitting idly and comfortably in their chairs, and a few nurses and various staff (certain ones, not all - some are very dutiful) gossiping and randomly taking very leisurely breaks tucked away behind the safety of the reception table inside the ER room, are part of this ""overwhelming"" demand on the hospital staff. To those whose who are giving it their all - I commend you. To those who think they deserve to put down the suffering of others because they despise their career choice - we are not sorry, as it isn't our fault your career path isn't working out the way you wanted.

I was a 9/10 for pain. I had a full bladder for 2 hours prior to coming to the ER. I waited another 6 hours. I almost passed out from the pain. The ER reception decided that I was low priority because of a preexisting mental health condition, and either thought that I was faking the pain, or was displeased by the scene that I was making (on account of the fact that I was writhing on the floor in pain). They called maybe 7 or 8 people, who were robust and agile on their feet, and who came in after me. When I ended up inside, I just saw a general ER doctor -as I found out later from the staff- and not a specialist, which would have justified the delaying of my visit. This ""triage"" definitely was not working. Another 2 hours with a full bladder, and I would have suffered irreversible damage and potentially death.

I am forever thankful to the doctor and nurses who treated me with grace and kindness inside the ER(I give them infinite stars separately as individuals). There were a few nurses that definitely belittled me and others like myself, but I pity them, as they hate their lives way more than I hated mine on that day that I spent in that hospital.

I stand by my 1 star rating for the hospital ER as the reception is critical to the overall functioning of the ER. I would give more stars if this was just some family physicians clinic with a bad reception, but this is the Emergemcy Room. Even the housekeeping staff showed a great deal of empathy, which was the opposite of what the reception had - a hatred for their jobs, and a disgust for how little the average patient's taxes contributed towards their income, compared to what must have amounted to the most insurmountable personal sacrifice they had to have to made for the average patient.

There were some wonderful staff who worked on the inside, but the hospital is completely broken if the ER reception is lacking in empathy, altruism and morality, as every step is crucial in case of a real emergency. This is a disaster waiting to happen. What if someone dies on their hands because of their disrespect for human suffering? Will they review their conduct then?

Individuals who do not respect human life, do not deserve to work in the healthcare industry. Regardless of how much of a favor you think you are doing the sick and misfortunate, remember it is a blessing to have secure employment, and it is not your God given right. Just because there is high demand for healthcare workers, does not mean there always will.

Shame on the staff who put our lives at risk. There is very little that an average sick individual at the mercy of the ER can do after the injustice, but those who toy with lives will remember their own shame."
https://lh3.googleusercontent.com/a/ACg8ocIqgdiPeIHEkci46aCBwq7Q059IH_nZMR8fqUPGO_IYaBl0Ua0=w43-h43-p-rp-mo-br100,Nol789,8 months ago,Worst hospital I have ever been to. If you need urgent care do not go here. Waited 10 hours with chest pain and trouble breathing and did not get help for 5 hours then after was told to wait again for another 3 and again for another 2 hours. I wish nothing good on these workers
https://lh3.googleusercontent.com/a-/ALV-UjWPszNQ8jhDCwqYnpNHFLRIFUIvabrSRbfSTq3scOHApzA6t_SBBg=w43-h43-p-rp-mo-br100,Marufa Hoque,a year ago,Their paediatric emergency room was well run. The staff was kind and thorough with my son. The wait was around 3 hours but that’s expected with the overburdened hospitals and staff across the province. I also appreciated the follow up appointment they provided to check up on my son after the emergency visit l. Overall a very good experience.
https://lh3.googleusercontent.com/a/ACg8ocISKzL5Ulb6pgH0KhuaKj-Uj2DeOqrFZ3TASmS5X5A9yII1Aw=w43-h43-p-rp-mo-br100,Taranjit Singh,a year ago,"Worse ever experience. This is short staffed hospital. I and my wife are in the hospital since last 13 hours and it seems like nobody cares. She is dilated and ready for the delivery and screaming since she is here and NOBODY JUST CARE. Nurses don't care and they are SHORT IN The hospital. Just out of words right now with mixed emotions. I am angry, disappointed, scared, and angry and angry. THEY JUST DON'T CARE"
https://lh3.googleusercontent.com/a-/ALV-UjUOsBfFIEq71JTUEcNUCQC_l6tdyFj2B57Hadb8LnpJ_rkft1c=w43-h43-p-rp-mo-ba2-br100,Sebastien Odjick,a year ago,I don't get why this hospital has such terrible reviews. But maybe because of my tracheostomy and I coughed out my cartilage from my resent surgery but they were really nice i went there a couple times for medical reasons the staff there were really kind. My dad who worked they was kind enough to take me because I had once a bladder infection and my tracheostomy which I mentioned earlier. Thank you Surrey memorial hospital staff.
https://lh3.googleusercontent.com/a-/ALV-UjVKC7ArA7d11FLAQRtGR1mNT8rSMw5zV4SBIQh9ULyYdfeA71wb=w43-h43-p-rp-mo-ba4-br100,klYnko,a year ago,"Another hospital, and it's pretty high tech and updated. Been treated well, but the fact it's a hospital, serving cold hospital food haha. Is what it is."
https://lh3.googleusercontent.com/a/ACg8ocIVYG0-kIiiK_QaPGD-WBChw4uzo7ChK5IkO5QqdCsPAUfIww=w43-h43-p-rp-mo-br100,Michael Barker,a year ago,"Terrible. I’ve been here 5x over 2 years.

Found out I have internal bleeding. The hospital suggested me to a clinic rather than getting started on the problem. I can die from this. Today is my 5th day, and nobody even talked to me when I walked into the hospital. They are under staffed. And the ones working are not properly putting patients through.

This is dramatically horrible.

Nobody should have to wait as long 2 hours just to be checked in.. yet alone the 14 hour wait I had last time to see a doctor just for him to tell me to go elsewhere and that recommendation waisted a week of my time.

this morning I’m vomiting because it continues to get worse and I’m still yet to hear anything in regards to actions to be taken for this to be fixed.

I support health care but I do not support this hospital. It’s more a business than anything. I do not feel like anything positive comes from surrey memorial. It’s in need of new people running it."
https://lh3.googleusercontent.com/a/ACg8ocLHl-ANes8slZQUHvgp8YS25vZF8qZfruwn8y-03TlquwO5dw=w43-h43-p-rp-mo-br100,Hind Al-Dasouqi,11 months ago,Everytime I come here I always end up regretting my decision. They’re rude. They’re slow. And the last couple times I’ve come I wait up to 10 hours just to end up leaving. Asked to get a summary for my visit before I left because I had already booked a doctors appointment prior to going to the hospital and they looked at me funny and I let them know I have an event and this is taking way to long and when I walked away I heard one of the ladies at the desk say “what’s there to summarize”. Don’t waste your time coming to this hospital.
https://lh3.googleusercontent.com/a-/ALV-UjVsUMaxBg7dsjR1kRFehLjB4vT3dGin6zMBNVg3CRPyesClbWQ=w43-h43-p-rp-mo-br100,raymond lindsay,a year ago,"Surrey Memorial Hospital Emergency room Doctors, I have seen past 16 months have given 101%.  The Doctor's  are positive, caring, understanding, supportive, they listen, give their time, are Great communicators. All have Great Qualities!
The finest Doctor's of the Universe!

Thank you"
https://lh3.googleusercontent.com/a/ACg8ocIUTFrTiQIrvcTrFfg1QrQ8Deh7Ze_gBfBcIfdBI89DT5v2xw=w43-h43-p-rp-mo-ba4-br100,Diana Garcia,4 months ago,"Just an overall mismanaged, toxic hospital. I'd rather go to Royal Columbian Hospital. Shame on management as it affects us patients!"
https://lh3.googleusercontent.com/a/ACg8ocIVEA4taibUnesGrkb_gDHwws8bKSldC0CEKYSrFAZh5VjRfg=w43-h43-p-rp-mo-br100,Kelli Julien,a year ago,"Terrible hospital- they allow people to smoke right out front the main entrance and exit doors where children and cancer patients walk to get into the hospital for appointments. There are cigarette butts everywhere and people lined up out front smoking. The nurses are rude and spend more time laughing and talking then actually doing there job. There is no communication between patients and there plans for them - the hospital is dirty and smells of pee. The rooms are filthy, the floors are black . I have pictures of a baby wipe that was used to clean the floor In front of my dad .  The cleaners are using filthy cleaning pads on their mops.
Doctors and nurses don’t read past files on patients instead they’re having a good time socializing about their weekend.
The floor my dad was on had open beds but still put people in the hall .
I can’t wait till doctors and nurses are held liable for their patients in Canada ! That day is coming and maybe then they will do their jobs or find another career."
https://lh3.googleusercontent.com/a/ACg8ocLRgAjY1UJ7PxCsLLrC4LRVJhok-giQa68idVS3wIZaIXtkcg=w43-h43-p-rp-mo-br100,Ying Zhao,a year ago,"I came to the emergency at 11pm on April 26th. I had been coughing for almost a month. My symptoms were very severe, but they didn't give me blood tests to make sure I had infection or not. Only X ray. And asked me to go back to family doctor and lied to me only family doctor can prescribe me the medicine. So I was diagnosed with pneumonia on 5/4. I know the doctors and nurses are very hard, but can you treat every patient with a fair and kind attitude? No normal person would like to wait for hours in line to see an emergency unless they are really sick and need help."
https://lh3.googleusercontent.com/a-/ALV-UjX0Ao8sbDKYOYxFHYI0P1PRjgpEtNVP5kN0nZTvM7rpBBmLtiI=w43-h43-p-rp-mo-br100,Adeeb Shums,a year ago,"The nurses are very rude and the hospital is committed to NOT hiring enough doctors or nurses to take care of the sick. If you have an emergency go elsewhere, the news has it all - they’ve left people dying waiting in TRIAGE for 15 hours. These nurses want our tax dollars but the very hands that feed you they are rude to you."
https://lh3.googleusercontent.com/a-/ALV-UjWPCilJ5uWmX7gNkv4zsaUCAGZF0YMrYky__IHEXYjHY48N2xkJ=w43-h43-p-rp-mo-ba3-br100,Mani Arora,a year ago,"Terrible terrible absolutely terrible. Hospital should not be even in existence they should all rot badly like they do with their patients. My friend’s mom lost her both legs and fingers because of their negligence and today also my son has to go there because he didn’t ask me before he went to this hell, they made him wait for 7 hours and 3 times gave him morphine while sitting when he couldn’t sit and then told him that’s all they can do and still he has to wait for 5 more hours. Where is humanity in Surrey I think totally gone out. I will be running a campaign to stop all the charities going to this hell through radio stations and other media stations because they are robbing communities by giving religious names to their rooms."
https://lh3.googleusercontent.com/a-/ALV-UjUX_ulBMZBG-ZTqV29xUGk5SIvVTv_vfrkYbabU6VNorVcBfDJjrA=w43-h43-p-rp-mo-br100,Nicole bowles,10 months ago,"The other day while staying at 3:14 hospital in psych ward for some reason they stole a diamond necklace off of my neck while I was sleeping a diamond necklace I was planning to give my daughter. I am sick to my stomach and appalled and disgusted and I want them to pay dearly for the disgusting they are disgusting people they are! I would like to know who to contact and footage from the date of febuary 9th
to know who to contact? And how to vet them dismissed"
https://lh3.googleusercontent.com/a-/ALV-UjW4ukup8sKOL6DDGOMnKw_8ZzE_H2dNrN4mo0GKvQ1Ljr7_UAM=w43-h43-p-rp-mo-br100,Light Bearer,2 years ago,I didn't believe that all of the negative reviews could actually be true but they are in fact true. Do not go to this hospital. You could drive to another city several hours away and be seen quicker than if you walk in here. I walk in here with crippling chest pains and 7+ hours later still nothing but attitude. Everyone involved in this facility should be ashamed of themselves. I am actually embarrassed as a Canadian that a facility like this can operate this way and have the staff behind the desk be so rude to you at the same time. Absolutely pathetic in every single possible way. When I finally decide to leave rather than wait another 7 hours they tell me I'm leaving against medical advice which is impossible because I hadn't seen a doctor to receive any medical advice. This emergency room would seriously be better off closed because they aren't helping anyone anyways so what is the point in wasting public money when you could divert it to a hospital that actually does something. Whoever is in charge of this hospital should be fired plain and simple because they are incompetent. Canadian healthcare seems to be the envy of the rest of the world but it is all smoke and mirrors. Once again. DO NOT GO TO THIS HOSPITAL THEY WILL NOT HELP YOU!!!
https://lh3.googleusercontent.com/a/ACg8ocIFwgvF7QMakV7rjPLED7wH3obUMS0FTIiUh_AXbB1NP_m7JQ=w43-h43-p-rp-mo-br100,Japji Kaur Sidhu,9 months ago,"I give 5 star to surrey birth unit at Surrey Memorial Hospital doctors and nurses are very caring and helpful,I am really appreciate with their service my mom is in India but at delivery time nurses take care of me like my mom really I love this experience."
https://lh3.googleusercontent.com/a/ACg8ocIZ1kbFKBJAF4Jn9W1aVTNo-OPYqczNiXCqAdZs7KYaXnc5TQ=w43-h43-p-rp-mo-br100,Susan Young,a year ago,"Cleanliness is not a strong point here, the photos are of the tray they serve food on.  Needless to say  I ate nothing for 3 days as I had no idea if dishes were washed as they are brown in colour

I must say though the staff and nurses were great."
