link,writer,time,text
https://lh3.googleusercontent.com/a/ACg8ocKFM5nr0R93-dzdCsOokOBGz3xbc3gIjPlUGsEhsurPNArC=w43-h43-p-rp-mo-br100,Rukmani Chauhan,a month ago,I had to wait for so long with my dad in the line and they said it would take 2 hours or so but it took at least 7 hours or more to get into another and another then finally I see the doctor after and the doctor was nice but the nurses weren’t he said he was gonna give me an iV and I asked if he could call my dad in and he got so mad then my sister came when the treatment was good she said can a nurse come and help me since I parked my car away from the hospital the nurse came and dropped me outside the hospital and left me with 2 druggies screaming in my ears it was such a horrible experience and anything could’ve happened to me if my sister didn’t come on time. The nurse should’ve had some humanity in her to not leave me with them outside
https://lh3.googleusercontent.com/a/ACg8ocJ4E0bc1MNq5QqV5hZ9cAKiRViQ8ee7Dn8Ig4XwT1QkiPJiYg=w43-h43-p-rp-mo-ba2-br100,David Anderson,a month ago,"I'm here at Surrey Memorial Hospital right now.
Arrived at 3:30 pm after being in a car accident.
It's 2:10 am as I write this review, I've yet to see a doctor.
Moved me from Triage to another room after 9 hours, now in waiting room. For 2.5 hours and counting.
Worst hospital experience of my life, and I've been in a Mexican Hospital.
What a 3rd World Experience.
Shame On Our Medical System!!"
https://lh3.googleusercontent.com/a/ACg8ocKUo0TjgWFvBSO45QH4yL5bfoSNOigG_dO6Cr6nGR_R5yS6OQ=w43-h43-p-rp-mo-br100,zaha star,2 weeks ago,"You better remind them if you have any allergies or severe  reactions to medications even if it is in your medical history, because I don't think they read your medical history. Few times I took family members who were admitted to mental health unit and had to advocate for them (since they couldn't talk for themselves at that time), had to remind the staff members of what medications had caused severe reactions. You would think that the mental health team would appreciate a family member's input since the family members would be the best advocate for the patient, second to the patient. I have found the mental health team members to be quite arrogant and sometimes rude; they don't want you to ask them questions, they believe that they are the experts and that's it. I guess they are not very aware of the mental health act, it's not what they say is the rule of law, patients have rights.  If the mental health team really CARE about the patients and their well-being they would involve the family members in care, they would appreciate family members input.  Just imagine if the mental health team in hospitals care enough to involve caring family members perhaps we wouldn't be having issues like what is happening downtown Surrey, Langley and Vancouver. Unfortunately these are individuals who had no one to speak on their behalf. These mental health team members at Surrey memorial ( PAU) need to re-educate themselves about dealing with people if they don't feel that they are not stable to work in such an environment please don't, there are plenty departments in the hospital they can go work in.  Only people who are capable being MINDFUL should work in mental health. I was extremely upset today when  I called at PAU to ask about my family member, just because I ask for the nurse to clarify what she was saying, she passed the phone to her colleague because she said I was being rude to her not knowing I heard what she was saying while handed the phone over. Just the way she talked to me made me feel very CONCERNED for the safety of my family member who is currently at PAU.  I just found out from my family member that they were given a medication that their community psychiatrist knows causes severe reaction, wouldn't that information be on the patient 's file?? What is going on?? Does the mental health team at Surrey memorial consider the patients as human beings? I should not  be having anxiety because I brought my family member to the hospital for treatment.  Hospitals are supposed to be safe environment??? I would hate to think that I or my  family member is being treated a certain way because of our cultural background. By the way the nurse at PAU talk to me , I am really having second thoughts about leaving my family members at Surrey memorial. Would they be treated fairly? Doctors please treat patients as individuals with unique experiences so that you may provide the best care. Doctors please care enough to investigate carefully ask questions and most of all please be mindful. Nurses need to practice being MINDFUL also."
https://lh3.googleusercontent.com/a-/ALV-UjVVkrkxGfzLZAhR7lbP-VA4nhuyt1u182vhVR4KMZPsN1BpiwIq=w43-h43-p-rp-mo-br100,akansha dogra,a month ago,"I had appointment for Audiology for my hearning test and I was unable to find the correct entrance and I just called the person I was assigned to named Angela, instead of helping me out she started saying nonsense stuff and was super rude ! I even told her that i won’t like to waste their time as i was already over 15 mins late. But as per their policy if we arrive late over 15 minutes we have to reschedule our appointment, so I asked her for rescheduling it instead. She seemed she did not wanted to be help me and sounded bit racist !!! I was just asking for a reschedule but she kept on increasing her tone and saying how I am irresponsible, even though I said sorry and just asked for reschedule right after 15 mins of spare time!! If you guys can be little more gentle and nice to your patients it will really help other clients who are coming from far away ! Just be nice, life is too short !"
https://lh3.googleusercontent.com/a/ACg8ocIRVegUID0MM_kt7voT9dKcNVMXXUUXY5ZBZdyFQP_v1F65Bg=w43-h43-p-rp-mo-br100,shahrookh ajmeri,a month ago,My experiences of visiting Surrey memorial hospital was horrible. The service was so slow and they just send you to different rooms only to wait for hours. The hospitals in underdeveloped countries must be operating better than them.
https://lh3.googleusercontent.com/a/ACg8ocLXvEJtgGI9SkncmLSzi--8GYC_M5_19_8lNFYel5kb2KKI4A=w43-h43-p-rp-mo-br100,brittany robbins,3 months ago,"I was pleasantly surprised, I had the best experience here recently. My daughter had a tonsillectomy with Doctor Kwok, he was absolutely lovely along with his whole team, and everyone had great bedside manner considering she was only 15. They made the whole experience, very smooth and as enjoyable as it can be. Thank you to everyone at Surrey Memorial who helped in the children’s wing."
https://lh3.googleusercontent.com/a/ACg8ocJS7VlmQ-RZXbYpVrPAdLXpkWkoNEipr32vtusGYFrbQSdbgQ=w43-h43-p-rp-mo-ba4-br100,Dahls Bermundo,2 months ago,"POV: 11 hours and counting at the ER... from 7pm to eternity due to abdomenal and back pains... the slowest hospital (no) care and service I have ever experienced in my entire life. I was put from 1 room to another and another and was asked to sit on a chair where there are several treatment rooms available. I was with 4 other patients in a treatment room for 5+ hours where nobody checked on us. I went to the nurses station to ask if someone is coming to see us. 4 staff - 3 younger ones where hanging out chatting and laughing at the nurses station, the other one walked away when she saw me approaching. That was very insulting and inconsiderate to us. They better change their careers or better yet review and understand their oath.

More so, it is the hospital system they need to re-evaluate. What is the use of having modern facilities but with a lousy staff. I understand the scarcity of doctors in ""Canada"" in general (paging Health Ministry- how do you address that? ) yet there are inconsiderate and lazy nurses hanging around laughing out loud while there are patients who are suffering in pain waiting for their care and compassion. What a shame!

In reality, there are a lot of medical doctors living here in Canada whom I believed more experienced and can do the job better yet our government because of Canadian standard they can't practice for gazillion of reasons. So how can this issue be reconciled?
Think. Think harder. Paging people who sits in the gov't.

Seriously, SMH needs new ER system.

My 2 stars are for the lab assistant who took my bloodworks and 1 Filipina staff who followed up on Treatment 14 room.

Hire more Filipinas and Filipinos who are warm and compassionate. Always wears a smile on their face. It helps alleviate the pains and sufferrings of the patients."
https://lh3.googleusercontent.com/a-/ALV-UjWQx3n6kork0k2gd03sLOtEcOCWBDY9_eydydlx90xh9dt60BPX=w43-h43-p-rp-mo-ba3-br100,Des Flannery,a month ago,"They get 3 starts soley because the pediactric section is fairly good, so lets start with good.

Peds are pretty good ive never spent more than 2-3hrs with my little guy and weve been about 3 times recently (toddlers are terrifying) honestly cant complain much about peds the staff are all super kind to the kiddos.

The main emergency department however is absolutely horrible, i honestly with is could review the 2 separately. The main ED is overflowing constantly, it can take hours for a simple x-ray, i saw a woman coughing up blood there once and she was still waiting for 5+hrs. They also have patients who test positive for covid mixed into the waiting room with nothing but a mask from home (usually cloth) They are short staffed i will give them that but if they had a separate section for homeless and drug users (2 very large problems in that area) then the ed would run a lot smoother. Overall if you arent in a state of life or death i would suggest the drive to a slightly further hospital (delta and peace arch arent too far and much less busy about 30-45mins each)"
https://lh3.googleusercontent.com/a-/ALV-UjUq0njka7q5OS3Z8uRDcWMp7imCFRTyHi7sIdu-6POstOne0gNweg=w43-h43-p-rp-mo-ba2-br100,Jeremy Bradford,4 months ago,The staff was friendly and very meticulous about the services they provide. My husband and I were traveling on a baby moon before we were planning to give birth. We are from the United States so we were nervous to visit a hospital out of country. They immediately took my vitals in the ER and directed me to labor and delivery to have me monitored. I am 37.5 weeks pregnant with twins and I was glad to know I could count on the kindness of staff to take care of me and relieve my anxiety so far from home.
https://lh3.googleusercontent.com/a/ACg8ocIDMeviuZnTHax0rav9F1XO8saoMK_Ar1tNRsUEv67zExlc9Q=w43-h43-p-rp-mo-br100,George Funk,4 weeks ago,"My son has cancer, he went to emergency because he could not swallow his own spit. Started out in emergency, shifted to a overflow. And now because they want to save money they shut down overflow, and put him in hallway. Because of his chemo and reduce immune system he should not be around other people. While he waits for his gtube surgery."
https://lh3.googleusercontent.com/a-/ALV-UjXvbb1m4uo9fZbtn2J3q6fAAyTBOOYYJhnLFDHEOmWICMg5gIBa=w43-h43-p-rp-mo-ba4-br100,Bumblebee,6 months ago,"The care that my Mom received in the palliative care unit was excellent.  It’s a 10 bed unit with quiet areas for families to rest and relax.  The nurses were kind, caring and attentive to my Moms needs at the end of her life.  Some of the rooms are shared which was stressful for my Mom.  She had a neighbour that had visitors all day long.  It was hard for her to have peace and quiet when she needed it the most.  After more than a week she was soon moved to her own room to have the privacy she and all the other patients deserve in this unit.  The reason for 4 stars is the stress our family experienced in a shared room.  I hope this unit can offer private rooms for all patients needing end of life care."
https://lh3.googleusercontent.com/a-/ALV-UjVU5d99kHIVqJcJtG39peK3K7cT3mwv8nLQY4mPb-cgd2FijQIn0A=w43-h43-p-rp-mo-ba5-br100,mini butalia,a month ago,I am really impressed from the quick response because the people were telling me we have to wait for long time to see the doctor but luckily there was too much pain  in my ears I was feeling my brain is going to explode but when I reached in emergency they do everything very fast I will explain step wise first they check blood pressure then fill all the information then I just wait for 15 minutes and they call inside and again there was one nice person katie she asked few questions she was very nice I think she was assistant doctor may be then after another 25 minutes doctor come outside with welcoming attitude he was genuinely very nice doctor his name was Dr David king he checked nicely and then inserted medicine in my ears and he referred to ENT next day I got appointment that ent doctor will check after two days so the treatment went well I am feeling fine now it was very horrific pain I felt on those days thank you so much Dr David king and Katie! Really I am grateful to you and inside hospital everything was so clean the ambiance was so quiet thank you everyone and surrey memorial hospital
https://lh3.googleusercontent.com/a/ACg8ocL2ljBAS6KUco8Snjwk9OCjVLGJQ8EcJ7QXmp9yorPZ1zQHJA=w43-h43-p-rp-mo-br100,Nancy Saini,a month ago,I had terrible experience with this hospital. I waited 11 hours then also I haven’t met with doctor. I had to come home like this only. They should hire more doctor so that patients won’t wait so long if they can’t they should close this hospital because it is wasting people time by making them wait so long just to go home without getting cured.
https://lh3.googleusercontent.com/a-/ALV-UjVO9d15WLtf8Y0hqLHtlnmcoYMsP-K_X9QH0wMUVzWW72LWAvPy=w43-h43-p-rp-mo-br100,hedyeh fazel tolami,3 weeks ago,"Im sorry I can not give more than 2 stars,I am in Family birth unit right now, I had c section last night and till now I couldn't sleep, there is no limitation for number if visitors,  it is written that after 10 p.m just 1 visitor us allowed,  but they never care about that,  my room is not private,  supposed to be!!!, my next bed had 4 visitors all night, and now 6 7 visitors for new patient,
I went to stationary and ask them to help, they said yes and they did bit never follow up, so it is 11:15 I must stay here and be patient!! It would be my last time in Surrey memorial hospital."
https://lh3.googleusercontent.com/a-/ALV-UjVjmooubqkgvtgClB8PtPfVgwMfRK2cVeQTTGtYTP80T3uvSvCL1A=w43-h43-p-rp-mo-ba4-br100,Sharath B.K,3 months ago,"Just absolutely pathetic condition that in a developed country, people have to go through this torturous procedure. We had to wait the whole night to get to see the doctor. This looked like a scam to me. The charges are quite high for non resident people and the doctor took 450$ as the fees and they sent a bill home for x-ray which is ridiculous. I was told it is all inclusive. Its a shame to say that no specialist is available"
https://lh3.googleusercontent.com/a/ACg8ocI7nAE-OE1O2cJZejqE5iqruTdUg2qbse_RGuwg7-XqTVrg1w=w43-h43-p-rp-mo-br100,Donna Gray,4 months ago,"This review is specific to the Lab. If I could give a zero, I would. Forget about booking an appointment - they don’t run on time and you should plan for them to be running 45 minutes behind schedule. All that might be tolerable if the people working there would at least acknowledge that they have a problem and stop being rude to the clients. Having cancer is bad enough without having to deal with this every week."
https://lh3.googleusercontent.com/a/ACg8ocIJhBGvTiKcVSmcmDPq7b6cM4ZC2GAZXGv9OQvsuywYvbBc4Bg=w43-h43-p-rp-mo-br100,Nancy Pabla,a week ago,I have very bad experience with family birthing unit . I was in labour visit four times here long time too waiting in queue. My delivery experience was very bad . My baby is in the nicu from last 17 days
https://lh3.googleusercontent.com/a-/ALV-UjUUeG0QjFH_ABsu0eOOiUkr7JaE8ZEb6ufpaPOci5LAL8XlL-E=w43-h43-p-rp-mo-br100,Lisa,2 weeks ago,"Had a good experience here, the nurses and doctor are very good here. I didn't wait too long and they were all respectful and caring 👍🙌 …"
https://lh3.googleusercontent.com/a-/ALV-UjU1S4c0FiljY18rehnVB_HJ5pj90z3EqI38L1cJFIWjQojTF3Y=w43-h43-p-rp-mo-br100,Carolyn JansenVanDoorn,a month ago,"My father passed away at surrey memorial hospital Last Thursday. He was septic but every single Person that we came into contact with were wonderful and  his care there was exceptional.   They were thorough, kind, compassionate, efficient and so amazing.  Above all dr. Ben Tuyp was beyond wonderful.  His kindness and compassion throughout a very awful time was so great.   I just want to say a huge thankyou to everyone that helped us through this very difficult time.  I’m sorry that I didn’t get everyone’s names but thank you!"
https://lh3.googleusercontent.com/a/ACg8ocJT216YEvW_lYF7wbv5P8uwzz-cxk3eWH8SMs_EuMtylw9KpQ=w43-h43-p-rp-mo-br100,priya morin,2 months ago,"Thank you to the wonderful staff working hard day in day out to keep us healthy. It is a busy place. They need more support.
Suggestion is to bring food, water bottle, comfy clothes, phone, charger and patience. Kind workers there under alot of pressure."
https://lh3.googleusercontent.com/a-/ALV-UjUFscFXGqKMFOZUdNHxicZalcxEw8OCCi5vHOyo1MLWbmWJxeA=w43-h43-p-rp-mo-br100,Dave D,a month ago,"No wonder there is long wait times. ai had to go in 4 times for the same thing and they still didn't do anything for me, I hurt my shoulder but at the time the pain was so bad I couldn't tell if it was my neck or my shoulder . I told the first dr I seen I think it's my shoulder he told me it's not my shoulder I was moving it fine without even checking my shoulder. Out of the 4 times I was there they sent me for an mri of my neck ct of my chest and head, xray of my chest neck. Fu ally the last guy sent me for an ultra sound after fighting for it but then they sent me too n
Royal Columbian that doesn't even do shoulder ultra sounds . Now I have to try pay over 700 to find someone to do an mri privately..This medical system is messed up."
https://lh3.googleusercontent.com/a/ACg8ocJU67JlJwkLT942vWY59RfjAz0NxHS8GMW69KQKGh2vV9ZftA=w43-h43-p-rp-mo-br100,Amarpreet Kaur,5 months ago,"We went to the hospital today. The nurse attended us..  was so so rude (Alex receptionist) I never wrote any review but he was rude to our kid as well. I don’t know why everybody was so confused there. If you guys don’t know how to deal with patients or to be nice with them or you guys don’t like your job you should leave. Nobody’s forcing you to do so. You guys should know how to deal with kids if you are in this profession.
Thank you."
https://lh3.googleusercontent.com/a-/ALV-UjWnjWOvlfQYcecNV5PZ7RwNyszLokl_9TnGrwI7QORiOPkYYpyhng=w43-h43-p-rp-mo-ba5-br100,Wild Wanderlust Photography,3 months ago,More Caucasian staff would be nice.  Some with accents very difficult to understand.   My father who is Croatian and speaks English very well could barely understand his nurse and the staff in emergency.  Let's try to be a little more diverse yes?? And I don't mean just south Asians and other ethnicities ....I'm talking about plain old white folks. Remember those?!?
https://lh3.googleusercontent.com/a-/ALV-UjU4AUeW_6Oo1R4FBiVP8MpKapEoZzSnhs7IfaQ_3cH7vXvAhq2_kg=w43-h43-p-rp-mo-ba3-br100,Ayesha Anzer,4 months ago,very bad experience. After waiting 8 hours no one attended me in emergency. I had a severe chest pain. I had to leave as my kids were at home. Nurse told me minimum waiting time is 12 hours. seriously!
https://lh3.googleusercontent.com/a-/ALV-UjUOFME8DauFGnjKqX3McsBAbbs20NAv33MCiZqcbGIq6QWUFVs=w43-h43-p-rp-mo-br100,Shak Nikjo,a month ago,"My wife is in pain Waiting to see doctor over 9  hours super busy  still waiting ……….😔for emergency, please use any other hospital not Surrey Memorial Hospital not recommended if I could give the service -0 I would do that.
Overall, all hospital in Canada is not good but all, but surrey is the worst  hospital in canada."
https://lh3.googleusercontent.com/a-/ALV-UjVTU31bvYJ5VdYaMVyss6sFiro5qNq1BcF_bN-LSDT4Z8kX026k=w43-h43-p-rp-mo-br100,EJM,4 months ago,"I was in this hospital for a while with a plural effusion, it was my first time ever to be admitted into a hospital which can be a bit of a frightening experience. While staying in 3 West for the duration of my treatment, the nurses and doctors were really amazing and super friendly which really helped to ease my stress and anxiety while having to stay in the hospital for a longer period of time. They ensured that me and the other patients were cared for very well and also answered all my questions and concerns with care and empathy which meant a lot.

I really appreciate the nurses like Rupi, Kulvinder, Sharan, Jasmeen, Sheryl, Grace, Kanchan and many more to follow as they were so kind and supportive which made my experience much more enjoyable and easy. Thank you so much everyone 💕"
https://lh3.googleusercontent.com/a/ACg8ocJt7pooDtlQQPZzkJcCvtV6pmo-tdMwdNq5rBe589AynB6yZQ=w43-h43-p-rp-mo-br100,sandeep gill,4 months ago,Staff doenot know how to treat with patient .they always rude .i came around 4 am in the morning through ambulance .i told the ambulance guy I have high pain in my stomach she ask the pain rating I told here 10 . Okk doctor  see me around 6.30 and he told me to go 22 cabin for city scan . I sit 7 hours there no one coming to me then I ask the status she said waiting for city scan. You go to reception area side from there they go a pick you .I politely ask if city scan pick from the reception area side what the purpose I wait in 22 cabin . She said rudely and yelling on me  go to reception. This is service we expect from hospital I never ever come to Surrey memorial . I should go somewhere but not go to Surrey memorial
https://lh3.googleusercontent.com/a/ACg8ocJQKXX_n4DsY5GAZTsbJCUpBbJvAWGWNvK-VdAognGe_dv3jg=w43-h43-p-rp-mo-br100,Vincenzo Bicego,4 months ago,"I was just at the Surrey Memorial Hospital in the resirology department (in the blue section) and those guys from the front desk to the back were fantastic.  They were friendly, professionally kind of people that had patience for their patients. I also noticed how well they worked together with good attitude.  I've been at the hospital a few times in the last month and a half and these guys have good chemistry with respect for others.  Thanks! For your service.
Vince Bicego"
https://lh3.googleusercontent.com/a-/ALV-UjUAxH8WZ6vGUwCglT81ocAvulag64YPUaJdx4x0XG-UukVxKYj4=w43-h43-p-rp-mo-br100,Charlie Kennington,2 months ago,"even if I was actively bleeding out a block away from this place, I'd ask the paramedics to take me literally anywhere else. the closest dentist or veterinarian would likely provide more compassionate, humane, and reliable care than surrey memorial hospital does."
https://lh3.googleusercontent.com/a/ACg8ocK7VEsZ-JGznaCMllWs_CX5Fh8ZC3t7TbCGKLq7a2z7lzrBnA=w43-h43-p-rp-mo-br100,Shental Seabrook,4 months ago,"I was recently here for internal bleeding and was sickened by the system. I will say anyone blaming staff, first and foremost they are strained resources trying their best and are not magicians. As i watched for 8 hours people use the emergency dept as a WALKIN CLINIC  for minor ailments you could have seen a regular gp for, a teledoctor online or even a pharmacist to prescribe minor ailments at your pharmacy. Instead people are congesting an EMERGENCY HOSPITAL putting people with actual high risk issues at risk due to overflow. Please give the staff respect. And staff, please when you see someone with a minor ailment complaining suggest a walkin or a local pharmacy pharmacist to prescribe their minor issues.  I suffered in a chair for 8 hrs in pain with blood coming out both ends due to internal bleeding and i should not have waited. I could have died from it .I puked in a room full of people and felt it was healthcare without dignity .The population needs to get a clue and take another option please if you need refills on your medication or a cold. Is it really an emergency?"
https://lh3.googleusercontent.com/a/ACg8ocJf9bEeg3cxd7wt_YmUBGp3F8OB1HKW5nGKJyZL_WcDo5zSqA=w43-h43-p-rp-mo-br100,Benipal Sukh Khattra,6 months ago,"I wish I could give them zero stars. I am a c-section mom who delivered a baby a few weeks ago. I went to the hospital at night because I was experiencing pain in my stitches. Despite informing them about my recent c-section, they ignored it and asked for tests. I didn't even get a bed, and it's very hard to sit for long periods after a C-section. It took 13 hours for them to see me. We arrived at 9:30 at night, and around 7 in the morning they did some tests. After 1 hour, they took tests again because they had mixed them up with someone else's in their rush. Finally, at around 9:30, I saw a doctor. I was expecting some medicine or treatment, but after waiting 13 hours, the doctor said everything looked good and referred me to another hospital to make an appointment with another doctor. It's unbelievable. I left my 10-day-old baby at home with my mother just to hear that everythinglooks good."
https://lh3.googleusercontent.com/a-/ALV-UjXAjad72qtSTu-KOCgY35zwkPSFJb7KgNjimFdOZxiZ1S95Qct8=w43-h43-p-rp-mo-br100,Lynn Norton,2 weeks ago,Fix your elevators!! When are you going to start putting money into your hospital?! What will it take ?? All the elevators to stop for you guys to actually do something? It's awful for staff and patients not to mention a safety concern!
