link,writer,time,text
https://lh3.googleusercontent.com/a-/ALV-UjUHDN5e5WMeZCICr1CjJsmM05kou5IgDFEVzc89phk1xzzuetqSEQ=w43-h43-p-rp-mo-ba3-br100,Lisa Ferrara,4 months ago,"I don't even know where to start tbh... Anyone who has to visit the Emergency area, you are going to be hugely disappointed! You Could be sitting in the hallway for days. Without testing or any care whatsoever. As far as the other wards go, it's not much better! I have Never seen anything so sad and disappointing in my life. The poor people, that are up in the Dementia ward...They are litterly sitting in a circle around the front desk. They allow people to walk into one another's rooms and steal they're belongings. Patients have gone without showering for long periods of time etc.... I realize staff is busy, but with 6 employees sitting around the desk 24/7, you would think one of them would know the name of a patient that has been in there for 2+ months😔 I pray to God, that I don't ever have to experience, what I've seen my family and friends have at this hospital 🙏"
https://lh3.googleusercontent.com/a/ACg8ocK5LUwcQxzaYlvcWE_V0MLri4aIWf4iMctuiVMRjc08r02JHA=w43-h43-p-rp-mo-br100,Loiu JS,5 months ago,"My elderly parents went to emergency hospital because my dad’s kidney function is below 10 as per blood result and he needs to see a doctor right away to get a prescription (antibiotic) .And we were told that the waiting is 18hrs which is normal.And we are free to leave if we can’t wait. I feel sorry for my dad he has a kidney failure and diabetic too..,,"
https://lh3.googleusercontent.com/a/ACg8ocKV1NSGDpt_FJun2fNw7k8BNOsvZm6i2x2Xilj7wWTvEwapw7o=w43-h43-p-rp-mo-br100,E M,6 months ago,"I went to the emergency room on Tuesday, May 3, with my child and I because I had respiratory asphyxia. Every time I felt suffocated, I had to yawn in order to get oxygen. I was feeling insomnia for fear of dying and leaving my child alone, so I did not sleep for 3 consecutive days. The doctor told me that this was only psychological anxiety and that I could Go to the home !!!!! Only a blood test was performed. How does a blood test give you results? I asked him to do an x-ray and an x-ray of the lungs only. He said that I was healthy and that I should talk to my family doctor so she could give me anxiety medication!!!!! Why is the heart, gland, vitamin D, and phlegm not examined to make sure, because until now I feel suffocated and I have no worries about anything except after suffocating to death and leaving my child alone in a country where I have no family or friends and I do not know anyone to check on me and make sure that I am alive and that my child is fine.  I know that there are only two doctors in the emergency room and they have to work under pressure due to the large number of patients, but this is a human life. The hospital must provide greater care for patients to examine the patient well and completely and find the problem that he is really suffering from."
https://lh3.googleusercontent.com/a-/ALV-UjWrVgzUtFjTiDAkE48ejJ20-N8b_vI0acOkCy2JlM1GAzxVnVU=w43-h43-p-rp-mo-br100,Ashleigh,3 months ago,"Avoid this horrible place! sadly this hospital can do so much better, ya I get it ya u going thro a lot but you don’t have to treat us like garbage we are human too!! Medical staff is just rude, doesn’t take anyone seriously wait times are ridiculous even if it is serious to them could just pass out in lobby no one would notice"
https://lh3.googleusercontent.com/a-/ALV-UjUgcbYgnZN9YG2VR5ewJRWxYqLidQIGJoBuxg0m6bYn-X8cW-FULA=w43-h43-p-rp-mo-ba5-br100,Shannon McWilliam,5 months ago,Pediatric emergency is amazing. Mom of 4 so we've been more times then I would have liked for various reasons but we always have a positive experience no matter how busy.
https://lh3.googleusercontent.com/a-/ALV-UjU1DYuVv3X3Kh_ca3Fhx35A-TjARMtqMLmw730W1KkB8PzpW_8=w43-h43-p-rp-mo-br100,vernon gowsell,4 months ago,"I have   copd in the past i have had flare ups that require medical care . The worst exsperience has been this year starting end of march upto today every 10 days to 2 weeks i have been returning to ERfor trouble breathing .my system dosent exspell the carbon dioxcide so i can get oxegen . I have had near 18 individule repeat visits  dthis last one is the worst ttreatment from staff ever . 2 days in a row they skipped o ver giving me luch or supper ,today i go to lobby for supper from overpriced kiosk and get meal and drinks for under 30 dollars . Then upon returning to ErAcute 2 bed 217 i find out that iam no longer in the system .
I have been evicked with out any docters approval or recomondation .
All this is making life very hard for me to understand why the abuse"
https://lh3.googleusercontent.com/a-/ALV-UjVjiytem6itjpqRMh0kPlYuXkK88505mIw4So1j_lIAo_7c6dtRXA=w43-h43-p-rp-mo-ba3-br100,Sara Bylo,6 months ago,"Nurses are great. However, if you come after 7:30am there will be 0 parking spots left. I had to take my son to emergency (too little to drop off) we circled the parkades for an hour before parking blocks away at the business center and having to drag him in the rain to the hospital. The nurses don't even have priority parking. They have to do the same thing."
https://lh3.googleusercontent.com/a/ACg8ocKOSerZvpTSym3IwHnVdzH7MTH-qcjSy6d1eJY_9XsZpif9eA=w43-h43-p-rp-mo-br100,Nida Ahmad,6 months ago,WORST EXPERIENCE!!!! The nurses are very unqualified they don’t care about the patients acts very rude towards them makes them heavily uncomfortable. Very long wait for no absolute reason. The hospital makes me want to leave Surrey in general. if u need a doctor just go to delta or van surrey memorial is not worth it!
https://lh3.googleusercontent.com/a-/ALV-UjUKtE4fV2M3fW6sJO18IdMP1Kn5pLF-EIwqQO41wFYUP78bLlni=w43-h43-p-rp-mo-ba4-br100,Malwinder Singh,6 months ago,"Surrey Memorial Hospital is one of those hospitals, which has created a name for itself in a negative way. There is no empathy in the staff, not towards anyone. Unless they know you or you have some links with the hospital staff, they do not give any attention to you. They do not care if you are young or old or even an enfant, they will equally disrespect you, make you suffer. Usually it is said that doctors and nurses are angels who comes after god, who can save your life. But Surrey Memorial Hospital is direct doorway to Death. And I am not writing this review just because of my own personal bad experience, but also due to several other bad experiences which my known ones faced during several visits. I would respectfully request everyone, if you have some condition, where you need medical assistance, try and find some other way to treat yourself, rather than going to this hospital."
https://lh3.googleusercontent.com/a-/ALV-UjX35ZOmUx0U-Hu7ZIfEi2KA7Rrf-o_FWKZ_YUgAE-RENSTtH3i2=w43-h43-p-rp-mo-ba2-br100,CROW,5 months ago,"One of the worst experiences I've had , I was admitted to the psych ward and because there were no beds they kept me sedated in a recliner chair for 3 days
I told them multiple times not to give me an anti psychotic because I have bad reactions to them
They gave it to me anyway and lo and behold I had a bad reaction

If you need psych help, go literally anywhere else. Even Langley was better and that was rough."
https://lh3.googleusercontent.com/a/ACg8ocJKcPRktk8ZnwHG8VPoeBcp8a8XJVeirfKMKmI0e7oaZQGwBcc=w43-h43-p-rp-mo-br100,Arif Sidhu,3 months ago,The worst hospital in the lower mainland. Went to the birthing unit today to see the doctor they made us wait 8 hours. The nurses were busy yapping and didn't give us any information about when the doctor would see us always just saying it's your turn next. Pathetic medical system
https://lh3.googleusercontent.com/a/ACg8ocJtq6qH-zJVz8u9XYr7dOaeUkXfUzjRrN-CFgpkwXjw7sSk2w=w43-h43-p-rp-mo-br100,Hope,2 months ago,If I could give no stars I would. Nurses are rude and swear at patients. If you come in more than once in a day they will refuse to triage you without police actively there
https://lh3.googleusercontent.com/a-/ALV-UjW-B2_TgrOo_ToTDvmAf6XCO9slJZf81qiM0_HpFFnIqSjLFNkQ=w43-h43-p-rp-mo-br100,37葉晶晶,5 months ago,"👎🏻👎🏻Terrible experience, my head was injured inside and broken skin and bleeding injuries on hands and knees. Instead of the proper treatment the nurse just gave me 3 painkillers then leave me waiting for 3 hours!!!! My head was super hurt and dizzy even after the painkillers, they still ignore my need for treatment and leave me waiting. If there’s concussion or intracerebral hemorrhage lead me to higher risk of death, how could they take this responsibility?????"
https://lh3.googleusercontent.com/a/ACg8ocJ2lDLtEGHL6oxsolf1EV19K4zvAcppO-oXnDU8nKb0fOzu=w43-h43-p-rp-mo-br100,Stefanie R,6 months ago,I went to Surrey memorial as I was put on the ventilator for having double pneumonia! Which turned into sepsis! I also had kidney failure and complications with my liver. With their attentiveness in their expertise they managed to cure me completely. Words fail me now but I am forever grateful and now my children have their mother back! Thank you ❤️
https://lh3.googleusercontent.com/a-/ALV-UjXEiwriXljgIzWfYDIs2fJ2FD1gbcaqpX5kzJCdXQlLjFPo8KQ3=w43-h43-p-rp-mo-ba3-br100,Carolyn McJannet,6 months ago,"Terrible terrible, rang for pain medication one night and care aid  came in after my bell rang for around 30 minutes & said I’ll let your nurse know if you can have it she’ll come and if you can’t she won’t and she walked away leaving me in pain laying there wondering if anyone was ever going to come. No one came that night. Only 1 of the incidents since I’ve been here not including being put on a water restriction for 3 days because they left a sign up from the person before me leaving me so dehydrated I could barely swallow anything I tried to eat, also being told day after something else was wrong and the nurse saying what? No one came to tell you? This place is so frustrating! I recommend going anywhere but SMH."
https://lh3.googleusercontent.com/a/ACg8ocKepl6GQsjlP9OHIldBkKRfPSnl15Gk-8-5lU0_JexKxLkrmg=w43-h43-p-rp-mo-br100,santosh gill 148,6 months ago,"Excellent technician, Sharlene.. and their receptionist were great!!
Thank you for frequently checking in and making me feel comfortable with this not-so-easy test--the MRI. AND they were on time!! The receptionist was also super helpful in making sure I was parked safely as well. Santosh  Gill,May 20 2024...Thank so much!"
https://lh3.googleusercontent.com/a-/ALV-UjXpq3clzDURKK5qQ_RNVY9-A4t3QR1eO_sqByBLJ9rP4iXlRKo=w43-h43-p-rp-mo-br100,ابو الريم,6 months ago,"Very bad service and all nurses are rude

And the hospital most the time is dirty no one care about to clean up"
https://lh3.googleusercontent.com/a/ACg8ocLaNUAa_T_nqroso9MaLPwRY19sM1q-EhVVs5gBQlqIOcftHA=w43-h43-p-rp-mo-ba3-br100,Jason G,6 months ago,"I came in last month with issues in my back, DR golden was wonderful. Actually took the time to exam and acknowledge what I was needing/going through........I felt actually heard compared to other hospitals/medical centers....if needed and your in the area. I'd recommend this hospital"
https://lh3.googleusercontent.com/a-/ALV-UjW8fNzZIAsh2O_LpL2a06JXBK5f9OHP6tYgbosuWydTTwwydEgxCQ=w43-h43-p-rp-mo-ba4-br100,Heather Mack,2 weeks ago,No organization whatsoever at pediatric the code white (violent patient) went on far longer then it should have with a some woman swearing and screaming at the top of her lungs
https://lh3.googleusercontent.com/a-/ALV-UjXHWJotMjhE5MqbGqss0dOx1tSMQXLeTKaq7dJhm-t0N80IsDUN=w43-h43-p-rp-mo-ba2-br100,Theresa Thomas,5 months ago,"My brother was very sick in the ICU. I wish I took note of the how the nurse spelt his name, but it was something like Greneesh or Gurneesh? He was so kind to my brother. He was approachable and caring and I could tell my brother was happy with him. My brother sadly passed away on May 3rd. I've thought about this nurse often, but wasn't sure how to send my warm and heartfelt thank you to this nurse. If you could let me know his name and where I can send a card I would be grateful."
https://lh3.googleusercontent.com/a/ACg8ocLyzYiNChA3L6EEOB4ClYVRwEwE9DKe9nR_o4i1U3CLyVAynA=w43-h43-p-rp-mo-br100,Phil Dauphinee,6 months ago,"Worst hospital in North America. Go here if you don't want treatment and prefer to die. GF went in for kidney disease and they had her on water restrictions because the sign on the wall from the last patient was still up and said so. Had high calcium and potassium in her blood so they gave her meds to reduce it but then fed her high calcium and high potassium foods for every meal. She threw up on the floor so the nurse came and tossed a towel on it and walked away. anytime we ask the nurse or doctor any question we get ""I don't know, let me go ask someone else"" and then never see that person again. Her nurse didn't come to see her all day and when she finally came she said ""sorry I was busy I had 3 other patients."""
https://lh3.googleusercontent.com/a-/ALV-UjWZaDFbPVBccMzEN5edlxNiePs-h9No_clG0okjJrpzNzWDYtUs=w43-h43-p-rp-mo-br100,Anzal Yusuf,6 months ago,"The nurses in this hospital are so rude. They should try being nice and friendly. Giving off bad energy is not acceptable. They don’t even talk to you nicely, especially the women nurses. Do better, everyone, and stop this attitude"
https://lh3.googleusercontent.com/a/ACg8ocJkc4u-NlysktDYxR7z4A-0vXLAopEA5fxJGk0SNyNOp7scWA=w43-h43-p-rp-mo-br100,Allison Dunlop,a month ago,Thank you to the Peds ER. My son was assessed and treated quickly. Great nursing care :)
https://lh3.googleusercontent.com/a-/ALV-UjU24GXxaZFOyteHkMxM13AYjuyp6uFDipBLu_AjE5krDQZHlzS27g=w43-h43-p-rp-mo-ba3-br100,Salony Kale,11 months ago,"Even Though it's the busiest hospital in BC, I am amazed by the level of service offered. I was afraid of being a first time mom, I had my pains started early in the afternoon and as instructed by my Surrey prenatal clinic doctor I spent the initial time at the comfort of my home in the bath tub keeping a track of contractions and how frequent they are... It got worse and worse & I visited the Family birthing unit, at 9 pm almost,  was requested to wait because of other patients as well waiting in the hall.. it was the toughest time in my life but I was taken in for a cervical examination and kept under observation for 20 minutes... I got dilated quickly & hence was immediately shifted into the birthing room. I am thankful to the receptionist, nurses and doctors who guided me throughout with utmost patience and professionalism."
https://lh3.googleusercontent.com/a/ACg8ocI104AMAeorrHWmpBZFBeZEeVGaqwA7hLW5Jw-25usZN40K5A=w43-h43-p-rp-mo-br100,Karissa Liebreich,8 months ago,"Brought my 4 year old here this morning for the first time as I had no other options, walk in clinics are non-existent and no one is taking new patients! Anyway, had a great experience here, the triage Nurse check us in quickly and we got moved to the back where another Nurse was waiting to check my daughter out. They ran tests and took a chest x-ray quickly and then saw the Doctor within an hour. Gave her meds and monitored her for awhile after and then sent us home.
I am so grateful to the Pediatric ER team for being so great to my kiddo and myself and for doing so quickly!! I definitely recommend bringing your babies here if you have no other options!"
https://lh3.googleusercontent.com/a/ACg8ocKacL81K3HEYecXyBTW9DRUy5HjaVj1LIDGUwuOKI6a5ra68g=w43-h43-p-rp-mo-br100,gena carachalios,10 months ago,"Cannot say enough good things about all the people that helped take care of me in N41. Everyone was kind and understanding and there to lend support when I needed it on my 7 day stay while I was waiting for an MRI. Was I aggravated that I had to wait 7 days for a MRI? Yes. Was any nurse or doctor to blame for my wait? No. Actually every day they were on the phone trying to get it expedited. People are yelling at these poor nurses that are showing up for work and trying there best instead of the government that is to blame for all the medical issues.
It’s sad what our medical system has come too."
https://lh3.googleusercontent.com/a/ACg8ocKZ56g7ncw8PO1nSMPgpsSqhyDDMd-NEz1IGurwELQInem1DE0=w43-h43-p-rp-mo-br100,Sameer Godara,10 months ago,Worst hospital in whole Canada my brother have cheast pain we vist the hospital at 10 pm and wait till 11 am almost 15 hours they think that we really like to spend time in the hospital and when we ask them that much time it will take they have no idea thay just tell as few hours
https://lh3.googleusercontent.com/a/ACg8ocIR5hOfC__VfqWf5gt0MX5hTN2oZiOGrfmn3em50iJUjbJ2SA=w43-h43-p-rp-mo-br100,Aman Sahota,7 months ago,"My delivery was on 21april and I appreciated my nurse joe, Doctor Mui and entire team who were in delivery room.Infect i got room immediately.I gave birth my son near by 11:30pm
And1:30 am i needed something and I called to nurse she came to my room and said we don’t have enough staff you have supporter (family member)or you can able to do your things by yourself.i mean How it was possible because i was in pain.after 12am night staff nurses were rude not all but few nurses.
Please do your duty properly with respect."
https://lh3.googleusercontent.com/a/ACg8ocIsR8E1k227qOyEVAvnc5OijgmpZFPh751OBm-BSoWEtIF9Qg=w43-h43-p-rp-mo-br100,Christina Jones,11 months ago,"This is the busiest hospital in BC. They deserve excellent reviews! It is super busy. They check everyone to make sure all Acute were taken care of first, my mom had signs of a stroke they rushed her in immediately. they have been caring, understanding and patient since recently she has been losing her hearing. Thank you to all for your hard work with a smile and dedication 😊"
https://lh3.googleusercontent.com/a-/ALV-UjWFbk0BU_AnaRNleF4zX0W7TqZ8laiCbp8tflFRCsB4HCnREUs=w43-h43-p-rp-mo-br100,Clyde Henderson,a month ago,"The nursing staff are few in number, but they genuinely care about people. If you're patient with them, they'll be patient with you."
https://lh3.googleusercontent.com/a-/ALV-UjV65gmB2nmcOTN_CjMbhYUpl5ayD2NQmlE1XZmy0zM-ZqYQSLUnHA=w43-h43-p-rp-mo-br100,Felizety Janzen,a year ago,"I don't get why this hospital has such terrible reviews. Maybe I was treated differently because I was a pediatric case, but I didn't wanna be discharged when I was here, that's how good it was. The pediatric nurses are the kindest people you'll ever meet. The doctors are amazing too, very understanding and are good listeners. The food was definitely eh.. but it was good enough. Shout out to my night nurse Molly at the pediatric ward who didn't wake me up the whole night! She was an angel. I don't mind having to go to the hospital anymore because of how all the staff are amazing people. Thank you for taking such good care of me and keep up the good work y'all ♥️🫂"
https://lh3.googleusercontent.com/a-/ALV-UjXzPXgI6R8ydiXU8rLTfBo8AtaNVUjLUFgDXd1vE_leiLYPO6A=w43-h43-p-rp-mo-ba3-br100,Trina Whitsitt,8 months ago,"Some good and some not so good nurse staff. Some were so short and rude. The Director, Chris, was lovely. He even brought his dog in to see us. Lindsay the HCA deserves a raise! She was just fantastic. Not the best care overall, …"
https://lh3.googleusercontent.com/a-/ALV-UjV6nYO0k1yVYnqaYke0rcwZSXOQ3-mUYPTGkQfPbkAAjidbxNid=w43-h43-p-rp-mo-ba4-br100,Vern Violan,9 months ago,"Had a good experience when I gave birth. The nurses and doctors were all nice. The food was good and the hospital is clean. I was anxious at first because of the many stories i heard but in my experience, everything was all positive and I was happy with their service."
https://lh3.googleusercontent.com/a/ACg8ocJG_bYdHqw8K2DiS_MgoMTErzuToiai-cShu3kJS54GGNL3fw=w43-h43-p-rp-mo-br100,Pawan Deol,6 months ago,"So unfortunate that this is the kind of care we have to put up with for my dad. For the most part, nurses in ICU are rude, uncaring and inattentive. Care is inconsistent at best. Breaks my heart that this is quality of care that is available for my dad. We all deserve better."
https://lh3.googleusercontent.com/a-/ALV-UjXbwxZp7npkbJ0f6jAi8d0q7xdqQpfjVHj21d6Tj1v0GIj8OG4L=w43-h43-p-rp-mo-br100,Sahiry Ireland,7 months ago,"My son was hospitalized at the children’s centre for two days and the staff was amazing! The food was terrible, and only the Mac and Cheese was decent. I am glad that they have many snacks for the children to eat. Other than the food, the care from the nurses, doctors, and support staff was excellent."
https://lh3.googleusercontent.com/a/ACg8ocJVrfuvcL1JIOO9lFIVeLFQEI6l4SpUx1gqgfU-8u_NPOCWMQ=w43-h43-p-rp-mo-br100,Connie Lam,4 months ago,"All the doctors work in this hospital are extremely nice and kind, they really treat you with their warm hearts and even really care about their patients family members feelings"
https://lh3.googleusercontent.com/a-/ALV-UjXPCfWaRi7Qv_2cdkdFWyZ-gSG656Jz5L6iXOW5g4mFtVtKTr0=w43-h43-p-rp-mo-ba2-br100,Celina Kwan,9 months ago,"Very bad experience in this hospital. It was not like that, 7 years ago. My Mom went there by ambulance at 12:15a.m after 3 hours still staying at the hallway. Also she need to washroom. I was informed the nurse. She needs to go very badly. No one showed up after more than 35 minutes. How could a sick person hold it that long??? After the units assistant showed with the attitude said why you put paper underneath? why she was wet? Seriously? If she has a choice, who wants to do that??? Unbelievable!!!"
https://lh3.googleusercontent.com/a/ACg8ocKm_xvjxDZfiX90HxO2HAuaOnIfHetG-fd5VALQ_QePKBKYuA=w43-h43-p-rp-mo-br100,HARDEEP KAUR,a month ago,"I've been admitted for a surgery from one week, I'm in terrible pain, waiting for that surgery from last week they kept giving me strong medicine putting me to sleep, but still no surgery, my surgery is even a half an hour procedure, would suggest to stay away from this hospital."
https://lh3.googleusercontent.com/a-/ALV-UjXzmu0K_LKijYdDAXVOo1ua_50Dc4cES37Fl_C44_Po7xT3rEk=w43-h43-p-rp-mo-ba5-br100,Helen ICE,11 months ago,"I gave 5 stars to this hospital even though I was in the emergency room for 8hrs on New Year’s eve. There were so many patients waiting and the nurses and receptionists were all very caring and friendly. I was particularly grateful for being treated by an amazing doctor- Dr D. Brace, who was very professional and super knowledgeable. It’s getting late and she was so patient and thorough. Her professionalism was very impressive. Thank you Dr Brace!"
https://lh3.googleusercontent.com/a-/ALV-UjUUIRY1q8nEW4lRKHkiV6JtUUGvp7B01DE5903wsRJiTOFl7fumKg=w43-h43-p-rp-mo-ba3-br100,BISWAJIT DE,9 months ago,My first baby was delivered in this hospital this week. The staff are well trained and the nurses were very kind. My wife and I had a very pleasant experience and we created a lot of new memories.
https://lh3.googleusercontent.com/a/ACg8ocJys55PCVeKY6ie0Br42tP_235ATyty42NPoOApr2xkcgXtdw=w43-h43-p-rp-mo-br100,Somnath Sharma,9 months ago,Never visited to this hospital please never. You will just waste of your 8 or 9 hours nothing else no treatment no facilities. There are no enough doctors and nurses here. And some of nurses on the counter and in catz  are too rude. No body cares about the condition of patients. I can't be say that Canada is best country to visit. The medical facilities are on zero level in Canada. I. Can't say it developed country. I think government should have ashamed on himself that they haven't doctor for their country' individuals. My country is 100 times better in medical field because you will get response just in two minutes superbb fast 🎊
https://lh3.googleusercontent.com/a-/ALV-UjXK0VhUsMZIOHQFbkH96oh5DqzTouEb5ICQT1aIumiZ1Na2Zq183w=w43-h43-p-rp-mo-ba4-br100,Muru R (Muruga),a year ago,The Systematic registration process and treatment for all medical emergencies. Staff are kind enough to guide us. The Doctors are giving good treatment. The only challenge here is waiting hours to get out turn.
https://lh3.googleusercontent.com/a/ACg8ocLEPczrF0JEs9aaF4HCLJhOdUtg7AmBPxkH8TymaF_oxIRRyuw=w43-h43-p-rp-mo-br100,amit saddi,a week ago,I just got my blood work by lab attendant namely Nell. She is awesome because I didn’t feel any type of pain during jab. Thanks  Nell
